{
  "$schema": "https://json-schema.org/draft/2020-12/schema",
  "$id": "https://github.com/autodesk-aps-mcp/endpoint.schema.json",
  "title": "Autodesk APS Endpoint",
  "type": "object",
  "required": ["group", "name", "method", "url", "description"],
  "additionalProperties": true,
  "properties": {
    "group": { "type": "string", "minLength": 1 },
    "name": { "type": "string", "minLength": 1 },
    "method": {
      "type": "string",
      "enum": ["GET", "POST", "PUT", "PATCH", "DELETE", "HEAD", "OPTIONS"]
    },
    "url": { "type": "string", "pattern": "^https://" },
    "description": { "type": "string", "minLength": 1 },
    "auth_required": { "type": "boolean" },
    "oauth_scopes": {
      "type": "array",
      "items": { "type": "string" }
    },
    "headers": { "type": "array" },
    "query_parameters": { "type": "array" },
    "uri_parameters": { "type": "array" },
    "response": { "type": "object" }
  }
}
