[
  {
    "group": "Data Management",
    "name": "Get User's Accessible Hubs",
    "method": "GET",
    "url": "https://developer.api.autodesk.com/project/v1/hubs",
    "description": "This endpoint returns a collection of accessible hubs for the authenticated user. Hubs represent BIM 360 Team hubs, Fusion Team hubs, A360 Personal hubs, and BIM 360 Docs accounts. Only active hubs are included in the response. The API also supports Autodesk Construction Cloud (ACC) projects.",
    "auth_required": true,
    "oauth_scopes": ["data:read"],
    "headers": [
      {
        "name": "Authorization",
        "type": "string",
        "description": "Bearer <token>, obtained via either a two-legged or three-legged OAuth flow."
      },
      {
        "name": "x-user-id",
        "type": "string",
        "description": "In a two-legged authentication context, the app can act on behalf of the user specified in this header."
      }
    ],
    "query_parameters": [
      {
        "name": "filter[id]",
        "type": "array",
        "description": "Filter hubs by their IDs."
      },
      {
        "name": "filter[name]",
        "type": "array",
        "description": "Filter hubs by their name."
      },
      {
        "name": "filter[extension.type]",
        "type": "array",
        "description": "Filter hubs by their extension type (team hubs, BIM 360 Docs accounts, personal hubs)."
      }
    ],
    "response": {
      "status_codes": {
        "200": "OK - Successfully retrieved the collection of accessible hubs.",
        "401": "Unauthorized - The Authorization header is invalid or missing.",
        "403": "Forbidden - The request is valid but permission is denied."
      },
      "body_structure": {
        "jsonapi": {
          "object": {
            "version": "1.0",
            "links": {
              "self": {
                "href": "string"
              }
            },
            "data": [
              {
                "type": "hubs",
                "id": "string",
                "attributes": {
                  "name": "string",
                  "extension": {
                    "object": {}
                  },
                  "region": "enum (US, EMEA, APAC)"
                },
                "relationships": {
                  "projects": {
                    "object": {}
                  },
                  "pimCollection": {
                    "object": {}
                  }
                },
                "links": {
                  "self": {
                    "href": "string"
                  }
                }
              }
            ]
          }
        }
      }
    }
  },
  {
    "group": "Data Management",
    "name": "Get Hub by ID",
    "method": "GET",
    "url": "https://developer.api.autodesk.com/project/v1/hubs/:hub_id",
    "description": "This endpoint returns detailed information about a specific hub identified by its hub ID. Hub IDs correspond to BIM 360 Docs account IDs (with a 'b.' prefix) and are compatible with Autodesk Construction Cloud (ACC) projects.",
    "auth_required": true,
    "oauth_scopes": ["data:read"],
    "headers": [
      {
        "name": "Authorization",
        "type": "string",
        "description": "Bearer <token>, obtained via either a two-legged or three-legged OAuth flow."
      },
      {
        "name": "x-user-id",
        "type": "string",
        "description": "In a two-legged authentication context, limits access to the specified user."
      }
    ],
    "uri_parameters": [
      {
        "name": "hub_id",
        "type": "string",
        "description": "The unique identifier of the hub. Note that BIM 360 Docs uses the format 'b.<accountId>' for hub IDs."
      }
    ],
    "response": {
      "status_codes": {
        "200": "OK - Successfully retrieved the specific hub data.",
        "400": "Bad Request - Malformed syntax or missing headers.",
        "403": "Forbidden - Permission denied or application not white-listed.",
        "404": "Not Found - The specified hub ID was not found."
      },
      "body_structure": {
        "jsonapi": {
          "object": {
            "version": "1.0",
            "links": {
              "self": {
                "href": "string"
              }
            },
            "data": {
              "type": "hubs",
              "id": "string",
              "attributes": {
                "name": "string",
                "extension": {
                  "object": {}
                },
                "region": "enum (US, EMEA, APAC)"
              },
              "relationships": {
                "projects": {
                  "object": {}
                },
                "pimCollection": {
                  "object": {}
                }
              },
              "links": {
                "self": {
                  "href": "string"
                }
              }
            }
          }
        }
      }
    }
  },

  {
    "group": "Data Management",
    "name": "Get All Projects in a Hub",
    "method": "GET",
    "url": "https://developer.api.autodesk.com/project/v1/hubs/:hub_id/projects",
    "description": "Returns a collection of active projects for a specified hub. Multiple projects can be created within a hub.",
    "auth_required": true,
    "oauth_scopes": ["data:read"],
    "headers": [
      {
        "name": "Authorization",
        "type": "string",
        "description": "Bearer <token>, obtained via a two-legged or three-legged OAuth flow."
      },
      {
        "name": "x-user-id",
        "type": "string",
        "description": "In a two-legged authentication context, the app has access to all users specified by the administrator."
      }
    ],
    "uri_parameters": [
      {
        "name": "hub_id",
        "type": "string",
        "description": "The unique identifier of a hub. For BIM 360 Docs, prepend 'b.' to the account ID."
      }
    ],
    "query_parameters": [
      {
        "name": "filter[id]",
        "type": "array[string]",
        "description": "Filter by the ID of the project."
      },
      {
        "name": "filter[extension.type]",
        "type": "array[string]",
        "description": "Filter by project extension type."
      },
      {
        "name": "page[number]",
        "type": "integer",
        "description": "Specifies the page number for pagination. Default is 0."
      },
      {
        "name": "page[limit]",
        "type": "integer",
        "description": "Specifies the maximum number of projects to return. Default is 200, maximum is 200."
      }
    ],
    "response": {
      "status_codes": {
        "200": "OK - The request has succeeded.",
        "400": "Bad Request - The request could not be understood by the server due to malformed syntax.",
        "401": "Unauthorized - Invalid or missing authorization token.",
        "403": "Forbidden - Insufficient permissions to access the hub.",
        "404": "Not Found - The resource or endpoint cannot be found."
      },
      "body_structure": [
        {
          "id": "string (UUID)",
          "name": "string",
          "extension": {
            "type": "string",
            "version": "string"
          },
          "region": "enum: string",
          "projects": {
            "data": [
              {
                "id": "string (UUID)",
                "attributes": {
                  "name": "string",
                  "status": "string",
                  "created_at": "datetime (ISO 8601)"
                }
              }
            ]
          }
        }
      ]
    }
  },
  {
    "group": "Data Management",
    "name": "Get Project by ID",
    "method": "GET",
    "url": "https://developer.api.autodesk.com/project/v1/hubs/:hub_id/projects/:project_id",
    "description": "Returns detailed information for a specific project within a given hub. Compatible with both BIM 360 and Autodesk Construction Cloud (ACC) projects.",
    "auth_required": true,
    "oauth_scopes": ["data:read"],
    "headers": [
      {
        "name": "Authorization",
        "type": "string",
        "description": "Bearer <token>, obtained via a two-legged or three-legged OAuth flow."
      },
      {
        "name": "x-user-id",
        "type": "string",
        "description": "In a two-legged authentication context, the app has access to all users specified by the administrator."
      }
    ],
    "uri_parameters": [
      {
        "name": "hub_id",
        "type": "string",
        "description": "The unique identifier of a hub. For BIM 360 Docs, prepend 'b.' to the account ID."
      },
      {
        "name": "project_id",
        "type": "string",
        "description": "The unique identifier of a project. For BIM 360 Docs, prepend 'b.' to the project ID."
      }
    ],
    "query_parameters": [],
    "response": {
      "status_codes": {
        "200": "OK - The request has succeeded.",
        "400": "Bad Request - The request could not be understood by the server due to malformed syntax.",
        "403": "Forbidden - Insufficient permissions to access the project.",
        "404": "Not Found - The specified project or hub could not be found."
      },
      "body_structure": [
        {
          "type": "string (constant: projects)",
          "id": "string (UUID)",
          "attributes": {
            "name": "string",
            "description": "string",
            "created_at": "datetime (ISO 8601)",
            "updated_at": "datetime (ISO 8601)"
          },
          "relationships": {
            "hub": {
              "data": {
                "type": "hubs",
                "id": "string"
              }
            }
          },
          "links": {
            "self": {
              "href": "string (URL)"
            }
          }
        }
      ]
    }
  },
  {
    "group": "Data Management",
    "name": "Get Hub from Project ID",
    "method": "GET",